uid,title,abstract,year,venue,authors,doi,arxiv_id,url,source,query,query_role,family,advisor_seed,citation_count,matched_terms,retrieved_at,relevance_score,hostile_score
doi:10.3390/s26010165,Cross-Modality Alignment Perception and Multi-Head Self-Attention Mechanism for Vision-Language-Action of Humanoid Robot,"For a humanoid robot, it is difficult to predict a motion trajectory through end-to-end imitation learning when performing complex operations and multi-step processes, leading to jittering in the robot arm. To alleviate this problem and reduce the computational complexity of the self-attention module in Vision-Language-Action (VLA) operations, we proposed a memory-gated filtering attention model that improved the multi-head self-attention mechanism. Then, we designed a cross-modal alignment perception during training, combined with a few-shot data-collection strategy for key steps. The experimental results showed that the proposed scheme significantly improved the task success rate and alleviated the robot arm jitter problem, while reducing video memory usage by 72% and improving training speed from 1.35 s to 0.129 s per batch. This maintained higher action accuracy and robustness in the",2025,Sensors,Bin Ren; Diwei Shi,10.3390/s26010165,,https://doi.org/10.3390/s26010165,crossref,vision language action model limitation robotics,hostile,failure,,1,vision language action model; humanoid robot; imitation learning; limitation; robustness,2026-06-12T14:45:03Z,15.647,21.647
arxiv:2511.15279v2,"Look, Zoom, Understand: The Robotic Eyeball for Embodied Perception","In embodied AI, visual perception should be active rather than passive: the system must decide where to look and at what scale to sense to acquire maximally informative data under pixel and spatial budget constraints. Existing vision models coupled with fixed RGB-D cameras fundamentally fail to reconcile wide-area coverage with fine-grained detail acquisition, severely limiting their efficacy in open-world robotic applications. We study the task of language-guided active visual perception: given a single RGB image and a natural language instruction, the agent must output pan, tilt, and zoom adjustments of a real PTZ (pan-tilt-zoom) camera to acquire the most informative view for the specified task. We propose EyeVLA, a unified framework that addresses this task by integrating visual perception, language understanding, and physical camera control within a single autoregressive vision-lang",2025,arXiv,Jiashu Yang; Yifan Han; Yucheng Xie; Ning Guo; Wenzhao Lian,,2511.15279v2,http://arxiv.org/abs/2511.15279v2,arxiv,Gaussian splatting robot perception embodied agent,concept,architecture_x_embodiment,,,vision language action model; Gaussian splatting robot perception; embodied agent; active perception,2026-06-12T15:07:36Z,21.550,21.550
doi:10.24963/ijcai.2025/1190,Generative Multi-Agent Collaboration in Embodied AI: A Systematic Review,"Embodied multi-agent systems (EMAS) have attracted growing attention for their potential to address complex, real-world challenges in areas such as logistics and robotics. Recent advances in foundation models pave the way for generative agents capable of richer communication and adaptive problem-solving. This survey provides a systematic examination of how EMAS can benefit from these generative capabilities. We propose a taxonomy that categorizes EMAS by system architectures and embodiment modalities, emphasizing how collaboration spans both physical and virtual contexts. Central building blocks, perception, planning, communication, and feedback, are then analyzed to illustrate how generative techniques bolster system robustness and flexibility. Through concrete examples, we demonstrate the transformative effects of integrating foundation models into embodied, multi-agent frameworks. Fin",2025,Proceedings of the Thirty-Fourth International Joint Conference on Artificial Intelligence,Di Wu; Xian Wei; Guang Chen; Hao Shen; Bo Jin,10.24963/ijcai.2025/1190,,https://doi.org/10.24963/ijcai.2025/1190,crossref,EBM transformer robotics embodied agent,concept,architecture_x_embodiment,,10,EBM transformer robotics; embodied agent; robustness,2026-06-12T15:07:36Z,19.549,21.549
title:look zoom understand the robotic eyeball for embodied perception,"Look, Zoom, Understand: The Robotic Eyeball for Embodied Perception","In embodied AI, visual perception should be active rather than passive: the system must decide where to look and at what scale to sense to acquire maximally informative data under pixel and spatial budget constraints. Existing vision models coupled with fixed RGB-D cameras fundamentally fail to reconcile wide-area coverage with fine-grained detail acquisition, severely limiting their efficacy in open-world robotic applications. We study the task of language-guided active visual perception: given a single RGB image and a natural language instruction, the agent must output pan, tilt, and zoom adjustments of a real PTZ (pan-tilt-zoom) camera to acquire the most informative view for the specified task. We propose EyeVLA, a unified framework that addresses this task by integrating visual perception, language understanding, and physical camera control within a single autoregressive vision-lang",2025,ArXiv.org,"Yang, Jiashu; Han, Yifan; Xie, Yucheng; Guo, Ning; Lian, Wenzhao",,,https://openalex.org/W7106475635,openalex,energy based transformer robot policy,concept,ebm_transformer,,,energy based transformer robot policy; vision language action model; active perception,2026-06-12T18:05:07Z,21.400,21.400
arxiv:2506.01844v1,SmolVLA: A Vision-Language-Action Model for Affordable and Efficient Robotics,"Vision-language models (VLMs) pretrained on large-scale multimodal datasets encode rich visual and linguistic knowledge, making them a strong foundation for robotics. Rather than training robotic policies from scratch, recent approaches adapt VLMs into vision-language-action (VLA) models that enable natural language-driven perception and control. However, existing VLAs are typically massive--often with billions of parameters--leading to high training costs and limited real-world deployability. Moreover, they rely on academic and industrial datasets, overlooking the growing availability of community-collected data from affordable robotic platforms. In this work, we present SmolVLA, a small, efficient, and community-driven VLA that drastically reduces both training and inference costs, while retaining competitive performance. SmolVLA is designed to be trained on a single GPU and deployed o",2025,arXiv,Mustafa Shukor; Dana Aubakirova; Francesco Capuano; Pepijn Kooijmans; Steven Palma; Adil Zouitine; Michel Aractingi; Caroline Pascal; Martino Russi; Andres Marafioti; Simon Alibert; Matthieu Cord; Thomas Wolf; Remi Cadene,,2506.01844v1,http://arxiv.org/abs/2506.01844v1,arxiv,vision language action model limitation robotics,hostile,failure,,,vision language action model; limitation; benchmark,2026-06-12T14:45:03Z,14.200,21.200
doi:10.1101/2025.05.01.651643,Towards Unraveling Biomolecular Conformational Landscapes with a Generative Foundation Model,"Abstract Recent advances in deep learning have revolutionized biomolecular structure prediction, yet a significant challenge remains: biological function emerges from dynamic equilibria across multiple conformational states rather than a single molecular structure. Here, we present OpenComplex2 (OC2), a generative model that efficiently sample biomolecular conformational ensembles. OC2 integrates a unified graph representation capturing diverse molecular inputs with diffusion-based sampling through our FloydNetwork architecture, which operates simultaneously across atomic, residue, and motif hierarchies. This multi-level approach balances fine-grained precision with computational efficiency, enabling conformational landscape sampling in hours rather than the weeks required by traditional simulations. Through comprehensive evaluation, we demonstrate that OC2 accurately reproduces experime",,,Qiwei Ye,10.1101/2025.05.01.651643,,https://doi.org/10.1101/2025.05.01.651643,crossref,robot foundation model failure mode,hostile,failure,,2,robot foundation model; failure mode; benchmark,2026-06-12T15:07:36Z,15.199,21.199
arxiv:1808.10654v1,Gibson Env: Real-World Perception for Embodied Agents,"Developing visual perception models for active agents and sensorimotor control are cumbersome to be done in the physical world, as existing algorithms are too slow to efficiently learn in real-time and robots are fragile and costly. This has given rise to learning-in-simulation which consequently casts a question on whether the results transfer to real-world. In this paper, we are concerned with the problem of developing real-world perception for active agents, propose Gibson Virtual Environment for this purpose, and showcase sample perceptual tasks learned therein. Gibson is based on virtualizing real spaces, rather than using artificially designed ones, and currently includes over 1400 floor spaces from 572 full buildings. The main characteristics of Gibson are: I. being from the real-world and reflecting its semantic complexity, II. having an internal synthesis mechanism, ""Goggles"", e",2018,arXiv,Fei Xia; Amir Zamir; Zhi-Yang He; Alexander Sax; Jitendra Malik; Silvio Savarese,,1808.10654v1,http://arxiv.org/abs/1808.10654v1,arxiv,Gaussian splatting robot perception embodied agent,concept,architecture_x_embodiment,,,Gaussian splatting robot perception; embodied agent,2026-06-12T15:07:36Z,19.800,20.800
doi:10.21203/rs.3.rs-5540665/v1,EARBench: Towards Evaluating Physical Risk Awareness for Task Planning of Foundation Model-based Embodied AI Agents,"Abstract Embodied artificial intelligence (EAI) integrates advanced Al models into physical entities for real-world interaction. The emergence of foundation models as the ""brain"" of EAI agents for high-level task planning has shown promising results. However, the deployment of these agents in physical environments presents significant safety challenges. For instance, a housekeeping robot lacking sufficient risk awareness might place a metal container in a microwave, potentially causing a fire. To address these critical safety concerns, comprehensive pre-deployment risk assessments are imperative. This study introduces the first embodied AI risk benchmark (EARBench), a novel framework for automated physical risk assessment in EAI scenarios. EARBench employs a multi-agent cooperative system that leverages various foundation models to generate safety guidelines, create risk-prone scenarios,",,,Baoyuan Wu; Zihao Zhu; Bingzhe Wu; Zhengyou ZHANG; Lei Han; Qingshan Liu,10.21203/rs.3.rs-5540665/v1,,https://doi.org/10.21203/rs.3.rs-5540665/v1,crossref,embodied world model planning control,concept,world_models,,,benchmark; deployment,2026-06-12T14:45:03Z,17.650,20.650
doi:10.1108/ir-06-2025-0222,Generalizable dual-arm fabric folding via parallel multiresolution attention,"Purpose This study aims to address the challenges of robotic cloth folding, stemming from complex dynamics and high degrees of freedom. While existing learning-based approaches have shown promise, they often suffer from limited generalization across diverse fabrics and require extensive real-world data. To address this gap, we propose a perception-centric strategy introducing HrcbamFolding, a dual-arm system that leverages a deep network to directly map visual inputs to the key manipulation points required. This approach simplifies the complex problems of state estimation and motion planning into a structured keypoint detection task, effectively bypassing the need for explicit physical modeling of the fabric. Design/methodology/approach This study proposes HrcbamFolding, which combines a multiresolution neural network with a channel–spatial attention mechanism to spotlight task-critical ",2026,Industrial Robot: the international journal of robotics research and application,Ruhan He; Jie Lu; Lianqing Yu,10.1108/ir-06-2025-0222,,https://doi.org/10.1108/ir-06-2025-0222,crossref,EBM transformer robotics industrial robot,concept,architecture_x_embodiment,,,EBM transformer robotics; industrial robot; sim to real transfer; state estimation; motion planning; benchmark; generalization; sample efficiency,2026-06-12T15:07:36Z,15.650,20.650
doi:10.54254/2755-2721/2025.ast27134,Integrating Motion Planning in Vision Language Action Agents,"Vision-Language-Action (VLA) models integrate visual perception, natural language understanding, and embodied control into a unified framework, enabling end-to-end task execution from multimodal instructions. While such models have demonstrated impressive generalization across tasks and environments, their direct outputs—often in the form of discrete action tokens or waypoint sequences—frequently overlook key physical constraints, such as trajectory feasibility, collision avoidance, and dynamic consistency. This limitation hinders deployment in safety-critical and dynamic real-world settings. Integrating motion planning into VLA systems offers a principled solution, embedding geometric and dynamic constraints into the control pipeline to transform high-level semantic goals into safe, smooth, and executable trajectories. This work examines representative integration strategies alongside t",2025,Applied and Computational Engineering,Jianfeng Pang,10.54254/2755-2721/2025.ast27134,,https://doi.org/10.54254/2755-2721/2025.ast27134,crossref,vision language action model limitation robotics,hostile,failure,,,vision language action model; motion planning; limitation; generalization; deployment,2026-06-12T14:45:03Z,11.650,20.650
doi:10.36227/techrxiv.176106902.20394622/v1,Exploring the Future of Robotics through Physics Informed Vision Based Foundations,"The integration of physics-grounded vision foundation models into robotics marks a transformative shift in the way machines perceive, reason about, and interact with the physical world. Traditional robotic perception pipelines have largely been limited to visual recognition tasks—such as object classification, segmentation, or detection—without an intrinsic understanding of the underlying physical dynamics that govern real-world interactions. This lack of physical reasoning often restricts robots to brittle, domain-specific solutions that fail under unstructured conditions. In contrast, physics-grounded vision foundation models extend beyond static perception to incorporate physical priors, causal reasoning, and dynamic prediction, thereby enabling robots not only to see but also to understand how objects and environments behave under forces, constraints, and interactions. By embedding p",,,Mariana Oliveira; Felipe Santos; Camila Ferreira; André Almeida; Gulnaz Rati,10.36227/techrxiv.176106902.20394622/v1,,https://doi.org/10.36227/techrxiv.176106902.20394622/v1,crossref,vision language action model limitation robotics,hostile,failure,,,vision language action model; embodied agent; domain randomization; limitation; benchmark; deployment,2026-06-12T15:07:36Z,11.650,20.650
arxiv:2605.12090v1,World Action Models: The Next Frontier in Embodied AI,"Vision-Language-Action (VLA) models have achieved strong semantic generalization for embodied policy learning, yet they learn reactive observation-to-action mappings without explicitly modeling how the physical world evolves under intervention. A growing body of work addresses this limitation by integrating world models, predictive models of environment dynamics, into the action generation pipeline. We term this emerging paradigm World Action Models (WAMs): embodied foundation models that unify predictive state modeling with action generation, targeting a joint distribution over future states and actions rather than actions alone. However, the literature remains fragmented across architectures, learning objectives, and application scenarios, lacking a unified conceptual framework. We formally define WAMs and disambiguate them from related concepts, and trace the foundations and early int",2026,arXiv,Siyin Wang; Junhao Shi; Zhaoyang Fu; Xinzhe He; Feihong Liu; Chenchen Yang; Yikang Zhou; Zhaoye Fei; Jingjing Gong; Jinlan Fu; Mike Zheng Shou; Xuanjing Huang; Xipeng Qiu; Yu-Gang Jiang,,2605.12090v1,http://arxiv.org/abs/2605.12090v1,arxiv,adaptive world action model,concept,architecture,,,world action model; adaptive world action model; human demonstration; teleoperation; limitation; generalization,2026-06-12T14:45:03Z,18.550,20.550
arxiv:2603.04363v1,ManipulationNet: An Infrastructure for Benchmarking Real-World Robot Manipulation with Physical Skill Challenges and Embodied Multimodal Reasoning,"Dexterous manipulation enables robots to purposefully alter the physical world, transforming them from passive observers into active agents in unstructured environments. This capability is the cornerstone of physical artificial intelligence. Despite decades of advances in hardware, perception, control, and learning, progress toward general manipulation systems remains fragmented due to the absence of widely adopted standard benchmarks. The central challenge lies in reconciling the variability of the real world with the reproducibility and authenticity required for rigorous scientific evaluation. To address this, we introduce ManipulationNet, a global infrastructure that hosts real-world benchmark tasks for robotic manipulation. ManipulationNet delivers reproducible task setups through standardized hardware kits, and enables distributed performance evaluation via a unified software client",2026,arXiv,Yiting Chen; Kenneth Kimble; Edward H. Adelson; Tamim Asfour; Podshara Chanrungmaneekul; Sachin Chitta; Yash Chitambar; Ziyang Chen; Ken Goldberg; Danica Kragic; Hui Li; Xiang Li; Yunzhu Li; Aaron Prather; Nancy Pollard; Maximo A. Roa-Garzon; Robert Seney; Shuo Sha; Shihefeng Wang; Yu Xiang,,2603.04363v1,http://arxiv.org/abs/2603.04363v1,arxiv,robot world models manipulation,concept,world_models,,,robot world model; robot manipulation; dexterous manipulation; benchmark; reproducibility; deployment,2026-06-12T14:45:03Z,16.500,20.500
doi:10.1609/aaai.v40i22.38910,TTF-VLA: Temporal Token Fusion via Pixel-Attention Integration for Vision-Language-Action Models,"Vision-Language-Action (VLA) models process visual inputs independently at each timestep, discarding valuable temporal information inherent in robotic manipulation tasks. This frame-by-frame processing makes models vulnerable to visual noise while ignoring the substantial coherence between consecutive frames in manipulation sequences. We propose Temporal Token Fusion (TTF), a training-free approach that intelligently integrates historical and current visual representations to enhance VLA inference quality. Our method employs dual-dimension detection combining efficient grayscale pixel difference analysis with attention-based semantic relevance assessment, enabling selective temporal token fusion through hard fusion strategies and keyframe anchoring to prevent error accumulation. Comprehensive experiments across LIBERO, SimplerEnv, and real robot tasks demonstrate consistent improvements:",2026,Proceedings of the AAAI Conference on Artificial Intelligence,Chenghao Liu; Jiachen Zhang; Chengxuan Li; Zhimu Zhou; Shixin Wu; Songfang Huang; Huiling Duan,10.1609/aaai.v40i22.38910,,https://doi.org/10.1609/aaai.v40i22.38910,crossref,vision language action model limitation robotics,hostile,failure,,,vision language action model; limitation,2026-06-12T15:07:36Z,15.300,20.300
arxiv:2510.17439v3,From Spatial to Actions: Grounding Vision-Language-Action Model in Spatial Foundation Priors,"Existing vision-language-action (VLA) models act in 3D real-world but are typically built on 2D encoders, leaving a spatial reasoning gap that limits generalization and adaptability. Recent 3D integration techniques for VLAs either require specialized sensors and transfer poorly across modalities, or inject weak cues that lack geometry and degrade vision-language alignment. In this work, we introduce FALCON (From Spatial to Action), a novel paradigm that injects rich 3D spatial tokens into the action head. FALCON leverages spatial foundation models to deliver strong geometric priors from RGB alone, and includes an Embodied Spatial Model that can optionally fuse depth, or pose for higher fidelity when available, without retraining or architectural changes. To preserve language reasoning, spatial tokens are consumed by a Spatial-Enhanced Action Head rather than being concatenated into the ",2025,arXiv,Zhengshen Zhang; Hao Li; Yalun Dai; Zhengbang Zhu; Lei Zhou; Chenchen Liu; Dong Wang; Francis E. H. Tay; Sijin Chen; Ziwei Liu; Yuxiao Liu; Xinghang Li; Pan Zhou,,2510.17439v3,http://arxiv.org/abs/2510.17439v3,arxiv,robot foundation model vision language action,concept,vla,,,vision language action model; robot foundation model; limitation; benchmark; generalization,2026-06-12T14:45:03Z,16.200,20.200
doi:10.24963/ijcai.2024/1190,Generative Multi-Agent Collaboration in Embodied AI: A Systematic Review,"Embodied multi-agent systems (EMAS) have attracted growing attention for their potential to address complex, real-world challenges in areas such as logistics and robotics. Recent advances in foundation models pave the way for generative agents capable of richer communication and adaptive problem-solving. This survey provides a systematic examination of how EMAS can benefit from these generative capabilities. We propose a taxonomy that categorizes EMAS by system architectures and embodiment modalities, emphasizing how collaboration spans both physical and virtual contexts. Central building blocks, perception, planning, communication, and feedback, are then analyzed to illustrate how generative techniques bolster system robustness and flexibility. Through concrete examples, we demonstrate the transformative effects of integrating foundation models into embodied, multi-agent frameworks. Fin",2024,Proceedings of the Thirty-ThirdInternational Joint Conference on Artificial Intelligence,Di Wu; Xian Wei; Guang Chen; Hao Shen; Bo Jin,10.24963/ijcai.2024/1190,,https://doi.org/10.24963/ijcai.2024/1190,crossref,EBM transformer robotics embodied agent,concept,architecture_x_embodiment,,,EBM transformer robotics; embodied agent; robustness,2026-06-12T15:07:36Z,18.150,20.150
doi:10.1093/jamiaopen/ooaf122,ECG-FM: an open electrocardiogram foundation model,"Abstract Objectives To develop ECG-FM, an open-weight foundation model for electrocardiogram (ECG) analysis, rigorously evaluate its performance on clinically salient tasks, and openly release it alongside a public benchmark. Materials and Methods In a study using 1.5 million 12-lead ECGs, we present ECG-FM, a transformer-based foundation model pretrained with hybrid self-supervision that combines masked reconstruction and contrastive learning with ECG-specific augmentation. Downstream, we evaluate multi-label ECG interpretation and prediction of reduced left ventricular ejection fraction (LVEF), introducing an openly available benchmark on the MIMIC-IV-ECG dataset. We assess ECG-FM’s capabilities through data scaling experiments, latent-space structure analysis, and attention-based saliency. Results Finetuned ECG-FM models outperform task-specific baselines in the small-to-medium-scale ",2025,JAMIA Open,Kaden McKeen; Sameer Masood; Augustin Toma; Barry Rubin; Bo Wang,10.1093/jamiaopen/ooaf122,,https://doi.org/10.1093/jamiaopen/ooaf122,crossref,robot foundation model failure mode,hostile,failure,,31,robot foundation model; failure mode; benchmark; reproducibility,2026-06-12T15:07:36Z,14.033,20.033
doi:10.3389/fnbot.2026.1846108,Research on embodied agent multimodal perception and real-time path planning algorithms for complex unstructured environments,"Autonomous navigation of embodied agents in complex unstructured environments demands tightly coupled multimodal perception and real-time path planning capabilities, forming a core technical bottleneck in physical-world robot deployment. Heterogeneous sensor data from visual, LiDAR, and depth modalities remain difficult to align and fuse under varying illumination and terrain conditions, while dynamic obstacle configurations impose severe latency constraints that existing planning algorithms fail to satisfy simultaneously. This paper proposes an integrated end-to-end framework combining a Cross-Modal Attention Fusion (CMAF) module, a Kalman-Graph Neural Network (K-GNN) dynamic obstacle predictor, and a two-layer Proximal Policy Optimization path planning architecture. The Cross-Modal Attention Fusion module fuses three-modal features through a multi-head attention mechanism, achieving a ",2026,Frontiers in Neurorobotics,Hexuan Ren,10.3389/fnbot.2026.1846108,,https://doi.org/10.3389/fnbot.2026.1846108,crossref,embodied world model planning control,concept,world_models,,,embodied agent; deployment; latency,2026-06-12T15:07:36Z,19.000,20.000
