uid,title,abstract,year,venue,authors,doi,arxiv_id,url,source,query,query_role,family,advisor_seed,citation_count,matched_terms,retrieved_at,relevance_score,hostile_score
doi:10.21203/rs.3.rs-9082476/v1,Systematic evaluation of single-cell foundation model interpretability reveals attention captures co-expression rather than unique regulatory signal,"Abstract Background : Single-cell foundation models such as scGPT and Geneformer are increasingly used for gene regulatory network (GRN) inference, with attention-derived edge scores routinely interpreted as regulatory proxies. However, whether attention patterns capture causal regulatory relationships—rather than statistical associations already present in expression data—has not been systematically tested. This gap is critical because the NLP interpretability literature has established that attention weights do not reliably indicate feature importance, yet this finding has not been rigorously evaluated in biological foundation models. Results : We present a systematic evaluation framework comprising thirty-seven analyses, 153 statistical tests, four cell types (K562, RPE1, T cells, iPSC neurons), and two perturbation modalities (CRISPRi, CRISPRa). Attention patterns encode layer-specif",,,Ihor Kendiukhov,10.21203/rs.3.rs-9082476/v1,,https://doi.org/10.21203/rs.3.rs-9082476/v1,crossref,robot foundation model failure mode,hostile,failure,,,robot foundation model; failure mode; ablation,2026-06-12T15:07:36Z,24.000,31.000
arxiv:2604.07430v1,HY-Embodied-0.5: Embodied Foundation Models for Real-World Agents,"We introduce HY-Embodied-0.5, a family of foundation models specifically designed for real-world embodied agents. To bridge the gap between general Vision-Language Models (VLMs) and the demands of embodied agents, our models are developed to enhance the core capabilities required by embodied intelligence: spatial and temporal visual perception, alongside advanced embodied reasoning for prediction, interaction, and planning. The HY-Embodied-0.5 suite comprises two primary variants: an efficient model with 2B activated parameters designed for edge deployment, and a powerful model with 32B activated parameters targeted for complex reasoning. To support the fine-grained visual perception essential for embodied tasks, we adopt a Mixture-of-Transformers (MoT) architecture to enable modality-specific computing. By incorporating latent tokens, this design effectively enhances the perceptual repr",2026,arXiv,Tencent Robotics X; HY Vision Team; :; Xumin Yu; Zuyan Liu; Ziyi Wang; He Zhang; Yongming Rao; Fangfu Liu; Yani Zhang; Ruowen Zhao; Oran Wang; Yves Liang; Haitao Lin; Minghui Wang; Yubo Dong; Kevin Cheng; Bolin Ni; Rui Huang; Han Hu,,2604.07430v1,http://arxiv.org/abs/2604.07430v1,arxiv,vision language action model limitation robotics,hostile,failure,,,vision language action model; embodied agent; limitation; benchmark; deployment,2026-06-12T14:45:03Z,17.850,25.850
doi:10.1145/3717059,"Embodied Intelligence: A Synergy of Morphology, Action, Perception and Learning","Embodied intelligence emphasizes that the intelligence is affected by the tight coupling of brain, body, and environment. It is continuously and dynamically generated through the process of information perception and physical interaction with the environment. During the past years, the research scope of embodied intelligence has also been expanding and has attracted great attention from various communities. At the same time, a huge number of works relevant to embodied intelligence have been proposed, especially in recent years. In this article, we present a comprehensive survey of embodied intelligence from the perspective that it is a synergy of morphology, action, perception, and learning, providing a thorough summary and categorization of existing studies. Specifically, as embodied intelligence is a synergy of all these components rather than themselves alone, we mainly focus on the c",2025,ACM Computing Surveys,Huaping Liu; Di Guo; Angelo Cangelosi,10.1145/3717059,,https://doi.org/10.1145/3717059,crossref,Gaussian splatting robot perception embodied agent,concept,architecture_x_embodiment,,54,Gaussian splatting robot perception; embodied agent,2026-06-12T15:07:36Z,25.704,25.704
arxiv:2512.00797v1,Transforming Monolithic Foundation Models into Embodied Multi-Agent Architectures for Human-Robot Collaboration,"Foundation models have become central to unifying perception and planning in robotics, yet real-world deployment exposes a mismatch between their monolithic assumption that a single model can handle all cognitive functions and the distributed, dynamic nature of practical service workflows. Vision-language models offer strong semantic understanding but lack embodiment-aware action capabilities while relying on hand-crafted skills. Vision-Language-Action policies enable reactive manipulation but remain brittle across embodiments, weak in geometric grounding, and devoid of proactive collaboration mechanisms. These limitations indicate that scaling a single model alone cannot deliver reliable autonomy for service robots operating in human-populated settings. To address this gap, we present InteractGen, an LLM-powered multi-agent framework that decomposes robot intelligence into specialized a",2025,arXiv,Nan Sun; Bo Mao; Yongchang Li; Chenxu Wang; Di Guo; Huaping Liu,,2512.00797v1,http://arxiv.org/abs/2512.00797v1,arxiv,robot foundation model failure mode,hostile,failure,,,robot foundation model; failure mode; limitation; deployment,2026-06-12T14:45:03Z,17.500,25.500
doi:10.48550/arxiv.2407.06886,Aligning Cyber Space with Physical World: A Comprehensive Survey on Embodied AI,"Embodied Artificial Intelligence (Embodied AI) is crucial for achieving Artificial General Intelligence (AGI) and serves as a foundation for various applications (e.g., intelligent mechatronics systems, smart manufacturing) that bridge cyberspace and the physical world. Recently, the emergence of Multi-modal Large Models (MLMs) and World Models (WMs) have attracted significant attention due to their remarkable perception, interaction, and reasoning capabilities, making them a promising architecture for embodied agents. In this survey, we give a comprehensive exploration of the latest advancements in Embodied AI. Our analysis firstly navigates through the forefront of representative works of embodied robots and simulators, to fully understand the research focuses and their limitations. Then, we analyze four main research targets: 1) embodied perception, 2) embodied interaction, 3) embodie",2024,arXiv (Cornell University),"Yang Liu; Weixing Chen; Yongjie Bai; Liang, Xiaodan; Guanbin Li; Wen Gao; Liang Lin",10.48550/arxiv.2407.06886,,https://doi.org/10.48550/arxiv.2407.06886,openalex,energy based transformer robot policy,concept,ebm_transformer,,13,energy based transformer robot policy; embodied agent; limitation,2026-06-12T18:05:07Z,22.520,23.520
doi:10.3390/electronics15030689,Embodied Visual Perception for Driver Fatigue Monitoring Systems: A Hierarchical Decoupling Framework for Robust Fatigue Detection and Scenario Understanding,"As intelligent vehicle technologies evolve, reliable driver monitoring systems have become increasingly critical for ensuring the safety of human drivers and operational reliability. This paper proposes a novel visual computing framework for Driver Fatigue Monitoring Systems (DFMSs) based on hierarchical decoupling and scenario element analysis, specifically designed for intelligent transportation environments. By treating the monitoring system as an engineering-level embodied perception–decision system deployed within the vehicle, rather than a purely disembodied vision module, the framework decouples low-level algorithmic perception from application-layer decision logic, enabling a more granular evaluation of visual computing performance in real-world scenarios. We leverage Python 3.9-driven automated test case generation to simulate diverse environmental variables, improving testing e",2026,Electronics,Siyu Chen; Juhua Huang; Yinyin Liu; Saier Ye; Yuqi Bai,10.3390/electronics15030689,,https://doi.org/10.3390/electronics15030689,crossref,Gaussian splatting robot perception embodied agent,concept,architecture_x_embodiment,,1,Gaussian splatting robot perception; embodied agent; benchmark; robustness,2026-06-12T15:07:36Z,19.347,23.347
doi:10.66967/jaics.2026.v2i103,Multimodal AI: PaLM-E’s Role in Vision–Language–Robotics & the Future of Efficient Fine-Tuning,"The convergence of vision, language, and robotics represents a critical step toward building embodied artificial intelligence systems capable of robust perception, reasoning, and action in real-world environments. This study presents a structured and analytical investigation of PaLM-E, an embodied multimodal language model, examining its role in unifying vision–language reasoning with robotic control across diverse task settings. Rather than proposing a new architecture, the work contributes a systematic synthesis and critical evaluation of PaLM-E’s capabilities, highlighting its zero-shot generalization, long-horizon task planning, and multimodal reasoning through comparative analysis with existing vision–language and robotic frameworks. In parallel, the study analyzes Parameter-Efficient Fine-Tuning (PEFT) strategies—focusing on Low-Rank Adaptation (LoRA) and Quantized Low-Rank Adaptat",2026,Journal of Artificial Intelligence & Control Systems,,10.66967/jaics.2026.v2i103,,https://doi.org/10.66967/jaics.2026.v2i103,crossref,vision language action model limitation robotics,hostile,failure,,,vision language action model; limitation; generalization; deployment; long horizon,2026-06-12T14:45:03Z,14.000,23.000
doi:10.24963/ijcai.2025/1168,A Comprehensive Survey on Physical Risk Control in the Era of Foundation Model-enabled Robotics,"Recent Foundation Model-enabled robotics (FMRs) display greatly improved general-purpose skills, enabling more adaptable automation than conventional robotics. Their ability to handle diverse tasks thus creates new opportunities to replace human labor. However, unlike general foundation models, FMRs interact with the physical world, where their actions directly affect the safety of humans and surrounding objects, requiring careful deployment and control. Based on this proposition, our survey comprehensively summarizes robot control approaches to mitigate physical risks by covering all the lifespan of FMRs ranging from pre-deployment to post-accident stage. Specifically, we broadly divide the timeline into the following three phases: (1) pre-deployment phase, (2) pre-incident phase, and (3) post-incident phase. Throughout this survey, we find that there is much room to study (i) pre-incid",2025,Proceedings of the Thirty-Fourth International Joint Conference on Artificial Intelligence,Takeshi Kojima; Yaonan Zhu; Yusuke Iwasawa; Toshinori Kitamura; Gang Yan; Shu Morikuni; Ryosuke Takanami; Alfredo Solano; Tatsuya Matsushima; Akiko Murakami; Yutaka Matsuo,10.24963/ijcai.2025/1168,,https://doi.org/10.24963/ijcai.2025/1168,crossref,foundation model limitation robotics,anti_myopia,anti_thesis,,1,limitation; deployment; foundation model limitation robotics,2026-06-12T15:07:36Z,17.597,22.597
arxiv:2604.03956v2,VLA-Forget: Vision-Language-Action Unlearning for Embodied Foundation Models,"Vision-language-action (VLA) models are emerging as embodied foundation models for robotic manipulation, but their deployment introduces a new unlearning challenge: removing unsafe, spurious, or privacy-sensitive behaviors without degrading perception, language grounding, and action control. In OpenVLA-style policies, behavior is produced through a fused visual encoder, a cross-modal projector, and a language backbone that predicts tokenized robot actions, so undesirable knowledge can be distributed across perception, alignment, and reasoning/action layers rather than confined to a single module. Consequently, partial unlearning applied only to the vision stack or only to the language backbone is often insufficient, while conventional unlearning baselines designed for standalone vision or language models may leave residual forgetting or incur unnecessary utility loss in embodied settings",2026,arXiv,Ravi Ranjan; Agoritsa Polyzou,,2604.03956v2,http://arxiv.org/abs/2604.03956v2,arxiv,robot foundation model vision language action,concept,vla,,,robot foundation model; deployment,2026-06-12T14:45:03Z,21.550,22.550
arxiv:2407.06886v8,Aligning Cyber Space with Physical World: A Comprehensive Survey on Embodied AI,"Embodied Artificial Intelligence (Embodied AI) is crucial for achieving Artificial General Intelligence (AGI) and serves as a foundation for various applications (e.g., intelligent mechatronics systems, smart manufacturing) that bridge cyberspace and the physical world. Recently, the emergence of Multi-modal Large Models (MLMs) and World Models (WMs) have attracted significant attention due to their remarkable perception, interaction, and reasoning capabilities, making them a promising architecture for embodied agents. In this survey, we give a comprehensive exploration of the latest advancements in Embodied AI. Our analysis firstly navigates through the forefront of representative works of embodied robots and simulators, to fully understand the research focuses and their limitations. Then, we analyze four main research targets: 1) embodied perception, 2) embodied interaction, 3) embodie",2024,arXiv,Yang Liu; Weixing Chen; Yongjie Bai; Xiaodan Liang; Guanbin Li; Wen Gao; Liang Lin,,2407.06886v8,http://arxiv.org/abs/2407.06886v8,arxiv,embodied world model planning control,concept,world_models,,,embodied agent; limitation,2026-06-12T14:45:03Z,21.350,22.350
doi:10.3390/robotics15030055,Embodied AI with Foundation Models for Mobile Service Robots: A Systematic Review,"Rapid advancements in foundation models, including Large Language Models, Vision-Language Models, Multimodal Large Language Models, and Vision-Language-Action Models, have opened new avenues for embodied AI in mobile service robotics. By combining foundation models with the principles of embodied AI, where intelligent systems perceive, reason, and act through physical interaction, mobile service robots can achieve more flexible understanding, adaptive behavior, and robust task execution in dynamic real-world environments. Despite this progress, embodied AI for mobile service robots continues to face fundamental challenges related to the translation of natural language instructions into executable robot actions, multimodal perception in human-centered environments, uncertainty estimation for safe decision-making, and computational constraints for real-time onboard deployment. In this pape",2025,arXiv,Matthew Lisondra; Beno Benhabib; Goldie Nejat,10.3390/robotics15030055,2505.20503v2,http://arxiv.org/abs/2505.20503v2,arxiv,energy based policy robotics,concept,ebm,,,vision language action model; deployment,2026-06-12T14:45:03Z,19.200,22.200
arxiv:2605.27582v1,Uni-LaViRA: Language-Vision-Robot Actions Translation for Unified Embodied Navigation,"Embodied navigation requires an agent to map language and visual observations to a stream of spatial actions that drive a real robot through environments it has never seen. The dominant approach has been to scale vision-language-action (VLA) foundation models on ever-larger collections of robot trajectories. This paper argues that, for navigation specifically, generality can be obtained structurally, not only through data scale. The underlying decision structure of navigation reduces to a single Language-Vision-Robot Actions Translation. The language action emits semantic-level directional command and the vision action emits a pixel-level visual target. Both outputs lie inside the natural output manifold of pretrained multimodal large language models (MLLMs), so the task can be reasoned about by an agent rather than learned from robot data. Therefore, we present Uni-LaViRA, a unified age",2026,arXiv,Hongyu Ding; Sizhuo Zhang; Ziming Xu; Jinwen Guo; Hongxiu Liu; Xingzhi Cheng; Zixuan Chen; Haifei Qi; Duo Wang; Hao Xu; Jieqi Shi; Yifan Zhang; Jing Huo; Jian Cheng; Yang Gao; Jiebo Luo,,2605.27582v1,http://arxiv.org/abs/2605.27582v1,arxiv,vision language action model limitation robotics,hostile,failure,,,vision language action model; humanoid robot; limitation,2026-06-12T14:45:03Z,17.200,22.200
doi:10.24963/ijcai.2024/1168,A Comprehensive Survey on Physical Risk Control in the Era of Foundation Model-enabled Robotics,"Recent Foundation Model-enabled robotics (FMRs) display greatly improved general-purpose skills, enabling more adaptable automation than conventional robotics. Their ability to handle diverse tasks thus creates new opportunities to replace human labor. However, unlike general foundation models, FMRs interact with the physical world, where their actions directly affect the safety of humans and surrounding objects, requiring careful deployment and control. Based on this proposition, our survey comprehensively summarizes robot control approaches to mitigate physical risks by covering all the lifespan of FMRs ranging from pre-deployment to post-accident stage. Specifically, we broadly divide the timeline into the following three phases: (1) pre-deployment phase, (2) pre-incident phase, and (3) post-incident phase. Throughout this survey, we find that there is much room to study (i) pre-incid",2024,Proceedings of the Thirty-ThirdInternational Joint Conference on Artificial Intelligence,Takeshi Kojima; Yaonan Zhu; Yusuke Iwasawa; Toshinori Kitamura; Gang Yan; Shu Morikuni; Ryosuke Takanami; Alfredo Solano; Tatsuya Matsushima; Akiko Murakami; Yutaka Matsuo,10.24963/ijcai.2024/1168,,https://doi.org/10.24963/ijcai.2024/1168,crossref,foundation model limitation robotics,anti_myopia,anti_thesis,,,limitation; deployment; foundation model limitation robotics,2026-06-12T15:07:36Z,17.050,22.050
doi:10.1163/22134468-bja10127,Meditation-Like States of Attention and Time Perception: Longer Productions in Deeper and More Embodied States,"Abstract Given the growing societal interest in how our environment influences time perception, in a world that is more volatile and going at a faster pace than ever, there is an increased need for the understanding of how attentional states and awareness impact time perception. In the current study we aimed at assessing the role of both internally and externally directed attention on temporal production. We devised an experimental paradigm aimed at replicating attentional states and awareness comparable to those occurring during meditation. Based on the Sphere Model of Consciousness and the hierarchy of meditation types, we hypothesize a gradual slowing down of time production, from simply observing a stimulus, to a focused awareness similar to Focused-Attention meditation and, finally, to an embodied state similar to Open-Monitoring meditation. To test this hypothesis, participants und",2025,Timing & Time Perception,Michele Pellegrino; Ludovica Ortame; Joseph Glicksohn; Patrizio Paoletti; Fabio Marson; Stefano Lasaponara; Maria Sofia Romano; Fabrizio Doricchi; Filippo Carducci; Tal Dotan Ben-Soussan,10.1163/22134468-bja10127,,https://doi.org/10.1163/22134468-bja10127,crossref,Gaussian splatting robot perception embodied agent,concept,architecture_x_embodiment,,,Gaussian splatting robot perception; embodied agent,2026-06-12T15:07:36Z,22.000,22.000
arxiv:2606.11324v1,Embodied-R1.5: Evolving Physical Intelligence via Embodied Foundation Models,"We introduce Embodied-R1.5, a unified Embodied Foundation Model (EFM) that integrates comprehensive embodied reasoning capabilities, spanning embodied cognition, task planning, correction, and pointing, within a single architecture toward general physical intelligence. Leveraging three automated data construction pipelines to significantly expand the data coverage of critical capabilities, we build a large-scale data system of over 15B tokens, and design a multi-task balanced RL recipe to alleviate heterogeneous task conflicts. We further introduce a Planner-Grounder-Corrector (PGC) closed-loop framework that enables a single model to autonomously execute and self-correct over long-horizon tasks. With only 8B parameters, Embodied-R1.5 achieves SOTA on 16 out of 24 embodied VLM benchmarks, surpassing leading models like Gemini-Robotics-ER-1.5 and GPT-5.4. Benefiting from the internalized ",2026,arXiv,Yifu Yuan; Yaoting Huang; Xianze Yao; Yutong Li; Shuoheng Zhang; Linqi Han; Pengyi Li; Jiangeng Sun; Wenting Jia; Zhao Zhang; Yuhao Liu; Ruihao Liao; Yucheng Hu; Qiyu Wu; Yuxiao Li; Zibin Dong; Fei Ni; Yan Zheng; Shuyang Gu; Yi Ma,,2606.11324v1,http://arxiv.org/abs/2606.11324v1,arxiv,embodied world model planning control,concept,world_models,,,benchmark; generalization; long horizon,2026-06-12T14:45:03Z,19.850,21.850
arxiv:2508.15201v2,Survey of Vision-Language-Action Models for Embodied Manipulation,"Embodied intelligence systems, which enhance agent capabilities through continuous environment interactions, have garnered significant attention from both academia and industry. Vision-Language-Action models, inspired by advancements in large foundation models, serve as universal robotic control frameworks that substantially improve agent-environment interaction capabilities in embodied intelligence systems. This expansion has broadened application scenarios for embodied AI robots. This survey comprehensively reviews VLA models for embodied manipulation. Firstly, it chronicles the developmental trajectory of VLA architectures. Subsequently, we conduct a detailed analysis of current research across 5 critical dimensions: VLA model structures, training datasets, pre-training methods, post-training methods, and model evaluation. Finally, we synthesize key challenges in VLA development and r",2025,arXiv,Haoran Li; Yuhui Chen; Wenbo Cui; Weiheng Liu; Kai Liu; Mingcai Zhou; Zhengtao Zhang; Dongbin Zhao,,2508.15201v2,http://arxiv.org/abs/2508.15201v2,arxiv,vision language action model limitation robotics,hostile,failure,,,vision language action model; limitation; deployment,2026-06-12T14:45:03Z,14.850,21.850
arxiv:2603.12193v1,SaPaVe: Towards Active Perception and Manipulation in Vision-Language-Action Models for Robotics,"Active perception and manipulation are crucial for robots to interact with complex scenes. Existing methods struggle to unify semantic-driven active perception with robust, viewpoint-invariant execution. We propose SaPaVe, an end-to-end framework that jointly learns these capabilities in a data-efficient manner. Our approach decouples camera and manipulation actions rather than placing them in a shared action space, and follows a bottom-up training strategy: we first train semantic camera control on a large-scale dataset, then jointly optimize both action types using hybrid data. To support this framework, we introduce ActiveViewPose-200K, a dataset of 200k image-language-camera movement pairs for semantic camera movement learning, and a 3D geometry-aware module that improves execution robustness under dynamic viewpoints. We also present ActiveManip-Bench, the first benchmark for evaluat",2026,arXiv,Mengzhen Liu; Enshen Zhou; Cheng Chi; Yi Han; Shanyu Rong; Liming Chen; Pengwei Wang; Zhongyuan Wang; Shanghang Zhang,,2603.12193v1,http://arxiv.org/abs/2603.12193v1,arxiv,vision language action model limitation robotics,hostile,failure,,,vision language action model; active perception; limitation; benchmark; robustness,2026-06-12T14:45:03Z,14.850,21.850
doi:10.66279/292sm294,Vision Language Action Models for Embodied Intelligence A Structured Taxonomy Critical Analysis and Future Research Directions,"Vision-Language-Action (VLA) models have emerged as a transformative paradigm in Embodied Artificial Intelligence by unifying visual perception, linguistic reasoning, and physical control within a single cohesive computational framework. By leveraging the semantic reasoning capabilities of large pre-trained Vision-Language Models (VLMs), VLA architectures promise to transition robotic systems from specialized, single-task agents to generalist robots capable of following natural language instructions in unstructured environments. This work provides a comprehensive review of the rapidly evolving VLA landscape, offering a structured taxonomy of state-of-the-art architectures ranging from unified transformer-based policies such as RT-2 and OpenVLA to emerging diffusion-based action generation methods. Key technical innovations driving the field are critically analyzed, including the integrat",2026,Computational Discovery and Intelligent Systems (CDIS),Ola Farid; Hamdi A. Mahmoud,10.66279/292sm294,,https://doi.org/10.66279/292sm294,crossref,vision language action model limitation robotics,hostile,failure,,,vision language action model; limitation; generalization; deployment; long horizon,2026-06-12T15:07:36Z,14.650,21.650
